{
  "id": "cac-grooming-chat",
  "version": "1.0.0",
  "profile": "FullCACLifecycle",
  "title": "CAC grooming chat construction",
  "description": "Promoted from topology/recipe-dags/cac-grooming-chat.json. Sequential Phase 2 path; trajectory advance is Phase 5.",
  "air_gapped": true,
  "related_recipes": ["docs/recipes/cac-grooming-chat-modeling.md"],
  "related_dags": ["topology/recipe-dags/cac-grooming-chat.json"],
  "inputs": [
    { "name": "hash_list", "type": "json", "required": false }
  ],
  "trajectories": ["grooming-phase"],
  "steps": [
    { "id": "load", "kind": "load_profile", "depends_on": [] },
    { "id": "open", "kind": "build", "handler": "open_investigation", "depends_on": ["load"] },
    { "id": "ingest", "kind": "ingest", "handler": "ingest_hash_list", "depends_on": ["open"], "optional": true },
    { "id": "hash", "kind": "build", "handler": "hash_media", "depends_on": ["ingest"], "optional": true },
    { "id": "critique", "kind": "critique", "depends_on": ["open"], "critique": "graph", "on_blocking": "continue" },
    { "id": "validate", "kind": "validate", "handler": "validate_partition", "depends_on": ["critique"], "on_blocking": "continue" },
    { "id": "emit", "kind": "emit", "handler": "emit_jsonld", "depends_on": ["validate"] }
  ]
}
